{"createdAt":"2026-09-16T08:59:21.623219Z","gates":[{"command":"python3 -m pytest -q backend/tests","completedAt":"2026-09-16T08:56:17.517092Z","logSha256":"bde228bb6718b88dc393b5f0808571a0d1067c86e1d9b5f2b42539db8482a71c","name":"backend","status":"passed"},{"command":"python3 -m pytest -q research-addon/tests","completedAt":"2026-09-16T08:56:20.142100Z","logSha256":"38ec6b608f8a018d56ece6630e0c953d139327da409230ebbadbe43c15a05c96","name":"sidecar","status":"passed"},{"command":"npm --prefix frontend test -- --run","completedAt":"2026-09-16T08:56:31.534131Z","logSha256":"506cf0bf70b2030c86e1ae741cc743b2d348f4c0ac544331fb9876af6c207b8f","name":"frontend-tests","status":"passed"},{"command":"npm --prefix frontend run lint","completedAt":"2026-09-16T08:56:35.790142Z","logSha256":"0d4695f4da2780a75fa8d28ae5fabe88093b7de3774417c514e2ecd90774e01f","name":"lint","status":"passed"},{"command":"cd frontend && npx tsc -p tsconfig.app.json --noEmit --incremental false","completedAt":"2026-09-16T08:56:38.830151Z","logSha256":"e3b0c44298fc1c149afbf4c8996fb92427ae41e4649b934ca495991b7852b855","name":"typecheck-app","status":"passed"},{"command":"cd frontend && npx tsc -p tsconfig.node.json --noEmit --incremental false","completedAt":"2026-09-16T08:56:39.827153Z","logSha256":"e3b0c44298fc1c149afbf4c8996fb92427ae41e4649b934ca495991b7852b855","name":"typecheck-node","status":"passed"},{"command":"npm --prefix frontend run build","completedAt":"2026-09-16T08:56:44.524166Z","logSha256":"0e3fa8e5f2d5bb97e2bad5fa4a653212fd63eee1c146d40a46b8acaaa90ccee8","name":"build","status":"passed"},{"command":"python3 -c 'from backend.app.main import app'","completedAt":"2026-09-16T08:56:44.869167Z","logSha256":"e3b0c44298fc1c149afbf4c8996fb92427ae41e4649b934ca495991b7852b855","name":"backend-startup","status":"passed"},{"command":"python3 -m pytest -q backend/tests/test_release_manifest.py backend/tests/test_write_release_manifest.py","completedAt":"2026-09-16T08:56:47.439174Z","logSha256":"37326b627c889d2d943b8a6491723985d497cfec0b9505319ae4b9727c500d72","name":"manifest","status":"passed"},{"command":"python3 -m pytest -q backend/tests/test_runtime_options.py","completedAt":"2026-09-16T08:56:54.375193Z","logSha256":"787ddd12cd551721ec2ddc1984b3b0a2e9c7d7d42556a93c824297309a4a5835","name":"runtime-options","status":"passed"},{"command":"python3 -m pytest -q backend/tests/test_release_preflight.py -k reject","completedAt":"2026-09-16T08:57:20.575264Z","logSha256":"a95c37283f2aaccba50945eaa00036b28ce07657f7da96934a8e9cbaacf4129b","name":"preflight-negatives","status":"passed"},{"command":"npm --prefix frontend audit --omit=dev --audit-level=high","completedAt":"2026-09-16T08:57:21.107265Z","logSha256":"6d8c5c8f3d7684adb070417bd608d01ae90aa3dc26a65af03ffda4955f38d9a3","name":"prod-audit","status":"passed"},{"command":"python3 -m backend.scripts.run_daytona_gpu_smoke --real-smoke","completedAt":null,"logSha256":null,"name":"daytona-gpu-smoke","status":"pending"}],"manifestSha256":"c00dc0c7278463f62ed532c05f5673d9f8ab5af43b4a0d1b0d3f71ea12deb7a2","overallPassed":false,"phase":"pre_cloud","remoteExecution":null,"schemaVersion":2,"sourceCommit":"40eade8727c0eed69cbb6b397bac0ea693103f02","toolVersions":{"python":"3.12.3"},"verificationCommit":"973d78d4fe2c35b7c85b3868d944c3e531769d34"}
